{
  "contractVersion": "1.0",
  "tMs": 93400000,
  "windowMs": 1000,
  "mode": "balanced",
  "schedulerState": "idle",
  "captureState": "awaitingPermission",
  "captureStopReason": "screen capture permission was revoked by the system",
  "looksPerSecond": 0,
  "looksTotal": 128,
  "framesSeen": 4100,
  "framesAnalysed": 212,
  "framesSkipped": 3888,
  "cacheHits": 91,
  "cacheMisses": 37,
  "activeTracks": 0,
  "activeCovers": 0
}
