{
  "contractVersion": "1.0",
  "tMs": 93205000,
  "windowMs": 1000,
  "mode": "balanced",
  "schedulerState": "watching",
  "captureState": "running",
  "captureSource": "mediaProjection",
  "foregroundPackage": "com.instagram.android",
  "looksPerSecond": 1.4,
  "looksTotal": 128,
  "framesSeen": 4100,
  "framesAnalysed": 212,
  "framesSkipped": 3888,
  "cacheHits": 91,
  "cacheMisses": 37,
  "activeTracks": 3,
  "activeCovers": 2,
  "aiMsLastLook": 38.5,
  "lookMsP50": 41.2,
  "lookMsP95": 77.9,
  "memoryPssKb": 214000,
  "thermalStatus": 1,
  "batteryImpactPctPerHour": 2.8
}
